{
  "$schema": "https://json-schema.org/draft/2020-12/schema",
  "$id": "https://github.com/utility-soc/dora-blueprint/drills/schema/drill-record.schema.json",
  "title": "Drill record",
  "description": "One flat JSON document per drill (build-spec §6.6). Deliberately boring: every field is either a measurement or a reference to one, never an assertion typed by a human at drill time.",
  "type": "object",
  "additionalProperties": false,
  "required": [
    "drill_id",
    "scenario",
    "git_sha",
    "cluster_profile",
    "controls",
    "verdict",
    "integrity_check",
    "t_inject",
    "t_recover"
  ],
  "properties": {
    "drill_id": {
      "type": "string",
      "description": "e.g. 2026-07-27-etcd-loss-004"
    },
    "scenario": {
      "type": "string",
      "description": "Matches a file under drills/scenarios/"
    },
    "git_sha": {
      "type": "string",
      "pattern": "^[0-9a-f]{7,40}$"
    },
    "cluster_profile": {
      "type": "string",
      "enum": ["core", "full", "dr"]
    },
    "controls": {
      "type": "array",
      "items": { "type": "string" },
      "description": "Article/control IDs this drill produces evidence for, e.g. DORA-Art11"
    },
    "target_rto_seconds": { "type": "integer", "minimum": 0 },
    "target_rpo_seconds": { "type": "integer", "minimum": 0 },
    "measured_rto_seconds": { "type": "integer", "minimum": 0 },
    "measured_rpo_seconds": { "type": "integer", "minimum": 0 },
    "measured_rpo_records_lost": {
      "type": "integer",
      "minimum": 0,
      "description": "max(counter) before fault - max(counter) after restore, from the canary"
    },
    "integrity_check": { "type": "string", "enum": ["pass", "fail"] },
    "verdict": { "type": "string", "enum": ["pass", "fail", "timeout"] },
    "recovery_verdict": {
      "type": "string",
      "enum": ["pass", "fail", "timeout"],
      "description": "The workflow template's own verdict (recovery and integrity only), kept when drills/lib/verdict.py re-derives `verdict` against the targets"
    },
    "verdict_reasons": {
      "type": "array",
      "items": { "type": "string" },
      "description": "Why the verdict is what it is: each failed objective, plus 'not assessed' notes for missing targets (drills/lib/verdict.py)"
    },
    "measured_rpo_records_lost_raw": {
      "type": "integer",
      "description": "A records-lost value that failed validation (negative, physically impossible), preserved for diagnosis instead of being dropped; see gap G15"
    },
    "classification": { "type": "string", "enum": ["major", "non-major"] },
    "classification_criteria_tripped": {
      "type": "array",
      "items": { "type": "string" },
      "description": "Which DORA Art. 18 RTS criteria tripped, from drills/lib/classify.py"
    },
    "manual_runbook_steps_required": {
      "type": "integer",
      "minimum": 0,
      "description": "Honest count of steps this drill could not automate — build-spec §6.6"
    },
    "t_inject": { "type": "string", "format": "date-time" },
    "t_detect": { "type": "string", "format": "date-time" },
    "t_classify": { "type": "string", "format": "date-time" },
    "t_notify_due_dora": {
      "type": "string",
      "format": "date-time",
      "description": "t_classify + 4h, capped at t_detect + 24h unless classified later than that, in which case t_classify + 4h (Delegated Reg. (EU) 2025/301) — build-spec §6.4/§0.4"
    },
    "t_notify_due_nis2": {
      "type": "string",
      "format": "date-time",
      "description": "t_detect + 24h — build-spec §6.4/§0.4"
    },
    "t_initial_submitted": {
      "type": "string",
      "format": "date-time",
      "description": "When the DORA initial notification was actually submitted, if recorded. Later deadlines run from it"
    },
    "t_intermediate_submitted": {
      "type": "string",
      "format": "date-time",
      "description": "When the (latest updated) DORA intermediate report was submitted, if recorded"
    },
    "t_notification_submitted_nis2": {
      "type": "string",
      "format": "date-time",
      "description": "When the NIS2 incident notification was submitted, if recorded"
    },
    "t_intermediate_due_dora": {
      "type": "string",
      "format": "date-time",
      "description": "72h from submission of the initial notification (DORA Art. 19(4)(b); Delegated Reg. (EU) 2025/301; basis in drills/lib/clocks.py LEGAL_BASIS)"
    },
    "t_final_due_dora": {
      "type": "string",
      "format": "date-time",
      "description": "One month from submission of the latest updated intermediate report (DORA Art. 19(4)(c); Delegated Reg. (EU) 2025/301)"
    },
    "t_notification_due_nis2": {
      "type": "string",
      "format": "date-time",
      "description": "72h from awareness (NIS2 Art. 23(4)(b)); t_detect stands in for awareness"
    },
    "t_final_due_nis2": {
      "type": "string",
      "format": "date-time",
      "description": "One month from submission of the NIS2 incident notification (NIS2 Art. 23(4)(d))"
    },
    "deadline_basis": {
      "type": "string",
      "description": "Whether later deadlines use recorded submission times or assume on-time submission (drills/lib/clocks.py)"
    },
    "t_recover": { "type": "string", "format": "date-time" },
    "t_verify": { "type": "string", "format": "date-time" },
    "artifacts": {
      "type": "array",
      "items": { "type": "string" },
      "description": "Paths/URIs to supporting evidence, e.g. s3://drills/<id>/velero.log"
    }
  }
}
